Title,Publication_type,Journal,Abstract,PMID
"Inventario de los macroinvertebrados acuáticos del «Ullal de Baldoví» (Sueca, Valencia, España) tras un programa de restauración",Scientific article,Boletín de la Real Sociedad Española de Historia Natural,"In the present study the inventory of aquatic invertebrates collected in the Ullal de Baldoví (Sueca, Valencia) is provided during the year 2007. It is an emblematic spring of oligohaline waters, located in the interior of the Albufera Natural Park of Valencia . We counted 81 taxa distributed in 6 edges, 24 orders and 57 families. The results have been obtained in six sampling stations distributed among the different Ullal environments, including a restored part. Three endemisms are found, of which one, Melanopsis tricarinata (Bruguière, 1789), is at the Iberian level and the other two, Dugastella valentina (Ferrer Galdiano, 1924) and Palaemonetes zariquieyi Sollaud, 1939, are for the Valencian Community ( CV). A new appointment is detected for the continental waters of the CV, an amphipod of the Aoridae family; Leptocheirus pilosus Zaddach, 1844. In the set of taxa, fifteen belong to the class Ostracoda, with two invasive alien species (EEI) Fabaeformiscandona subacuta (Yang, 1982) and Stenocypris major (Baird, 1859). The results obtained seem to indicate that the recent restoration has allowed, until now, the colonization of new taxa in the Ullal de Baldoví.",Positive
La importancia del agrosistema tradicional Faxinal para la conservación de los bosques en el sur de Brasil.,Scientific article,Revista Ecosistemas,"Faxinal constituye una forma deorganización y producción tradicional campesina caracterizada por la producción colectiva de animales en los sub-bosques de Araucarias. Esos creadores comunitarios componen algunos de los últimos remanentes conservados de la Mata Atlántica en los altiplanos sur-brasileños, mereciendo así el status de ARESUR – una unidad de conservación polémica, no totalmente reconocida, que recompensa a propietarios por su compromiso con la conservación de los bosques. Algunos autores argumentan que estos esfuerzos son inútiles ya que esto no protege la integridad de los bosques. Así, para comprobar la importancia de ese agrosistema analizamos la estructura fitosociológica de seis faxinales, comparando con un bosque también secundario preservado en Bosque Nacional Açungui. Se identificaron entre los faxinales y el área de conservación un total de 172 especies (42 familias) y el mayor Índice de Valor de Importancia correspondió a las especies de Casearia (decandra, obliqua y sylvestris), Cinnamodendron dinisii, Podocarpus lambertii, Ilex paraguariensis, Matayba elaeagnoides, Ocotea odorifera, Eugenia pluriflora, Campomanesia xanthocarpa, Myrceugenia myrcioides y Myrcia hatschbachii. El análisis comparativo apunta que los bosques en los faxinales no son estructuralmente diferentes del área conservada en Açungui, a pesar de que hayan algunas diferencias florísticas. Se puede concluir que los esfuerzos por preservar a criadores comunitarios de faxinales son consistentes con las estrategias de conservación para la permanencia de la Mata Atlántica.",Positive
"Restauración de bosque nativo en un área invadida por tamariscos Tamarix ramossisima en el sur de la provincia de Córdoba, Argentina",Scientific article,Revista Ecosistemas,"El hombre produce impactos acumulativos sobre los ecosistemas, siendo las especies exóticas invasoras uno de los más relevantes. Uno de los fines de la restauración ecológica es  reparar los ecosistemas para que sean capaces de persistir en ambientes futuros. Este trabajo tiene como objetivo diseñar e implementar técnicas de manejo para la recuperación de ambientes invadidos por tamariscos Tamarix ramossisima en el sur de Córdoba (Argentina). Se realizó un ensayo de restauración consistente en el control de tamariscos (tala y aplicación de herbicida), selección y plantación de especies nativas y evaluación del banco de semillas germinable del bosque de tamarisco y del bosque nativo de referencia. Se delimitaron doce parcelas donde se aplicaron cuatro tratamientos: 1) testigo; 2) control de tamariscos; 3) control y plantación de especies nativas; y 4) control, plantación de especies nativas y trasplante de banco de semillas. Se monitoreó durante 20 meses las variables rebrote de tamarisco, riqueza de la comunidad, cobertura de las especies nativas, emergencia y supervivencia de las plántulas del banco de semillas. El 89 % de los individuos de tamarisco no rebrotaron. Las especies seleccionadas y plantadas fueron Lycium boerhaviifolium, Vachellia caven, Schinus fasciculatus, Celtis ehrembergiana y Atriplex undulata. El banco de semillas no aportó nuevos individuos de especies nativas. Se destaca la importancia de la revegetación con especies leñosas nativas luego del control de tamariscos como estrategia para incrementar la biodiversidad.

",Positive
Meta-análisis de los efectos de la retirada de la madera quemada sobre la regeneración de los bosques mediterráneos: un paso hacia una gestión basada en la evidencia,Scientific article,Revista Ecosistemas,"Muchos gestores basan sus decisiones en su experiencia de campo acumulada, pero no en la bibliografía científica primaria o el consejo por parte de científicos. Es muy infrecuente una gestión basada en la evidencia científica, consistente en el meta-análisis de la bibliografía primaria para dirimir entre opciones de gestión ambiental. Este artículo ilustra esta aproximación con el ejemplo de la gestión de la madera quemada en los bosques Mediterráneos. Tradicionalmente, tras los incendios en muchas partes del mundo, incluido el Mediterráneo, se lleva a cabo la corta y retirada de la madera quemada, usando argumentos económicos, ecológicos y estéticos. Sin embargo, existe una corriente contraria a esta práctica argumentando, entre otras razones, un potencial efecto negativo de la retirada de la madera quemada sobre la regeneración del bosque. Un meta-análisis de la bibliografía pertinente en el Mediterráneo indicó un efecto nulo (densidad y altura de plántulas) o negativo (supervivencia de plántulas) de la retirada de la madera quemada sobre la regeneración del bosque. Aunque un meta-análisis con un tamaño de muestra tan bajo como el posible en el presente estudio no permite conclusiones firmes sobre la gestión de la madera quemada, sí sugiere que: (1) la gestión actual no está en concordancia con la (escasa) evidencia disponible, al menos en lo tocante a la regeneración del bosque quemado y (2) es necesario recabar una evidencia más firme sobre esta práctica de gestión forestal.

",Positive
"Restauración del medio marino en la reserva marina de Tabarca (Alicante, España): estructura y variaciones temporales de la ictiofauna asociada al arrecife artificial",Scientific article,Mediterranea,"El arrecife artificial de Tabarca se diseñó e instaló principalmente con el objetivo de impedir la pesca de arrastre ilegal sobre las praderas de Posidonia oceanica. Además se diseñó un arrecife alveolar experimental para estudiar sus efectos sobre la ictiofauna litoral y sus posibilidades como lugar de pesca alternativo a la flota artesanal de Tabarca. La ictiofauna asociada al arrecife artificial de Tabarca se estudió mediante censos visuales durante tres años consecutivos entre 1990 y 1992, con una frecuencia estacional. Los resultados muestran una estructura de la comunidad condicionada por el diseño y emplazamiento de los módulos. La dinámica temporal manifiesta una clara diferencia según consideremos el poblamiento total o sólo el residente: el primero refleja una pauta muy fluctuante, poco predecible; el poblamiento residente muestra una tendencia hacia la estructuración, con un aumento progresivo de especies sedentarias predadoras, y un incremento significativo de la biomasa. Estos resultados refuerzan las interpretaciones que dan un papel condicionante al tamaño del arrecife artificial y a su localización.",Positive
Mantencion de peces nativos dulceacuicolas de Chile en cautiverio: un aporte a su conservacion ex situ,Scientific article,Boletín de Biodiversidad de Chile,"Se genero conocimiento basico para la adecuada mantencion en cautiverio de los peces nativos Percilia gillissi, P. irwini (Perciformes), Trichomycterus areolatus (Siluriformes), Cheirodon galusdae (Characiformes) y Galaxias platei (Osmeriformes). Los peces se mantuvieron en acuarios entre 10 a 750 l, con sustratos de arena, grava y canto rodado, con plantas, aireacion y filtro biologico. Las variables fisico-quimicas del agua fueron mantenidas mediante cambios semanales de agua entre un 10 y 30% del volumen del acuario. Se mantuvo densidades entre 0,100 y 0,900 g l-1 , segun especie y talla. De los alimentos ensayados, Percilia spp. acepto solo alimento vivo. Las demas especies consumieron alimento vivo y comercial. El alimento vivo fue entregado a saciedad y el comercial en dosis de hasta un 2% del peso de los peces, por tres a cuatro veces por semana. La enfermedad del ‘punto blanco’ aparecio durante las primeras dos semanas del ingreso de los peces y afecto a Percilia spp., T. areolatus y G. platei. Fue tratada exitosamente con sal de mar en una concentracion maxima de 2 g l-1 . Las especies P. irwini y P. gillissi fueron las que presentaron mayor dificultad en su mantencion por la aparicion de la enfermedad del punto blanco y una aceptacion lenta a los alimentos.",Positive
"Metodo  simple  y  economico  para  minimizar  la  mortalidad  de  aves  acuaticas  en  piscinas  de lixiviacion de cobre, en el norte de Chile",Scientific article,Biodiversity and Natural History,"La mineria extractiva es vital para el desarrollo tecnologico en el mundo donde Chile ocupa el primer lugar como exportador mundial de cobre. Sin embargo, Esta actividad genera depositos de relave y piscinas de emergencia con aguas extremadamente toxicas y acidas, que son utilizadas por numerosas especies de aves, provocando generalmente la muerte de numerosos individuos. Teck CDA diseño e instalo sobre las piscinas de emergencia un sistema de lineas con banderines de colores suspendidos y se evaluo su efectividad como estrategia para evitar el uso de las piscinas por aves acuaticas y reducir la mortalidad. Entre los años 2011 y 2017 se ejecuto un programa de monitoreo de las aves que usan las piscinas de emergencia, piscinas claras y el embalse contiguo. Nuestros resultados indicaron que durante el periodo de uso de los banderines no se observo la muerte de ningun individuo de alguna especie de ave que potencialmente podria interactuar con las piscinas. Se concluye que el sistema de lineas de banderines plasticos de colores sobre las piscinas de emergencia de lixiviacion de cobre, fueron efectivos evitando el uso de las piscinas toxicas y minimizando las muertes de las aves acuaticas.",Positive
Nidos artificiales en plantaciones de Pinus radiata en el sur de Chile: ¿una herramienta para mitigar impactos ambientales negativos?,Scientific article,Revista Chilena de Historia Natural,"La biodiversidad de los ecosistemas naturales es afectada por el monocultivo silvicola de especies exoticas, siendo la perdida de habitats silvestres una de las principales causas de los problemas de conservacion que afectan a la ornitofauna chilena, mucha de la cual no habita los rodales de Pinus radiata por su homogeneidad espacial y carencia de refugios. Para evaluar la aceptacion (habitabilidad y nidificacion) de casas anideras en rodales de P. radiata del sur de Chile se instalaron 116 nidos artificiales apropiados para aves insectivoras. Los nidales artificiales tuvieron una alta aceptacion en las dos areas de estudio (98,4% en Temuco y 66,6% en Valdivia). Se observo un aumento de la aceptacion a partir de octubre (1992) llegando a practicamente un 100% de ocupacion en febrero ( 1993). El porcentaje de casas operables se mantuvo alto durante todo el estudio. Las casas anideras fueron habitadas casi en su totalidad por Troglodytes aedon (chercan) y solo una por Passer domesticus (gorrion). T. aedon construyo nidos en forma de taza, con base de ramas de U/ex europaeus, P. radiata, Rubus ulmifolius, hojas de Eucaliptus globulus, y, en la parte superior plumas de contorno y filoplumas. Las aciculas de P. radiata fueron el material de construccion preferido. El uso de nidos artificiales para atraer aves resulto exitoso, y si se mejora el habitat para la ornitofauna, es posible atraerlas a los bosques exoticos de P. radiata. Las casas anideras que construimos fueron de bajo costo y, unidas a tecnicas de manejo como perchas-posaderas, senderos y agroforesteria, podrian tener beneficiosas repercusiones en la conservacion de la biodiversidad y el control biologico de plagas forestales, lo que implicaria una mitigacion de los impactos ambientales negativos de las plantaciones monoespecificas y coetaneas de P. radiata.",Positive
"Efectos del fuego sobre un bosquecillo de Polylepis australis (Rosaceae) en las montañas de Cordoba, Argentina",Scientific article,Revista Chilena de Historia Natural,"El fuego es usado para transformar bosques en pastizales y estimular el rebrote de los pastos para aumentar su valor forrajero. Segun algunos autores, este uso del fuego ha provocado una retraccion de los bosques de Polylepis a sitios rocosos inaccesibles al fuego, mientras que otros autores postulan que su distribucion es debida al ambiente favorable en las rocas y no a la accion del fuego. Aqui evaluamos el efecto relativo del fuego y el ambiente sobre la supervivencia, produccion de semillas y crecimiento de Polylepis australis Bitter (Rosaceae) en un bosquecillo de las montañas de Cordoba. Realizamos un seguimiento de 74 individuos quemados y controles durante 3,5 años. La presencia de rocas tuvo una fuerte influencia en el porcentaje en que se quemaron los individuos. A su vez, el porcentaje en que se quemaron se relaciono negativamente con la supervivencia, produccion de semillas y el crecimiento en altura. La produccion de biomasa fue mayor cuando se quemaron en un porcentaje intermedio. Exceptuando la proteccion al fuego, la roca no tuvo ningun efecto positivo sobre las variables medidas. Estos resultados sugieren que la distribucion actual de P. australis es al menos en parte debida al fuego. Para su conservacion sugerimos minimizar los fuegos, desarrollar actividades con alto riesgo de incendio en sitios con alta proporcion de roca y, si es posible, proteger los ejemplares expuestos al fuego con piedras.",Positive
El fuego favorece la invasion de Teline monspessulana (Fabaceae) al aumentar su germinacion,Scientific article,Revista Chilena de Historia Natural,"A nivel mundial, se ha reportado que las especies invasoras y el fuego pueden interactuar positivamente modificando la dinamica del paisaje y los ciclos ecosistemicos. Este trabajo tiene por objetivo estudiar el efecto de los incendios forestales sobre el banco de semillas de Teline monspessulana (L.) K. Koch (Retamilla) y sus
implicancias para la invasion de la especie en la zona mediterranea del centro-sur de Chile. Para cumplir con este objetivo, muestras del banco de semillas fueron sometidas a diferentes tratamientos que simulan las condiciones de un incendio, a traves de quemas controladas. Ademas, para semillas tomadas desde plantas adultas se estimo el rango optimo de temperaturas a las que ocurre la germinacion. Los resultados muestran que despues de un incendio forestal la germinacion de T. monspessulana aumenta significativamente, siendo el calentamiento de las semillas el factor que gatilla este aumento. Por otro lado, se determino que las semillas alcanzan su maxima tasa de germinacion cuando son precalentadas entre 80 y 120 ºC por 10 minutos, produciendose la muerte del 100 % de las semillas a los 140 ºC. Durante un incendio las temperaturas optimas para la germinacion al interior del suelo se alcanzaron cerca de los 2 cm de profundidad o bien en zonas donde la acumulacion de combustible superficial (biomasa) no supera las 5 ton ha-1. La pequeña porcion del banco de semillas que logra ser estimulada se compensa con la gran cantidad de semillas presente en los bancos que puede superar las 8000 semillas m-2. Este estudio demuestra que el fuego, fenomeno comun en zonas mediterraneas y crecientemente frecuente en Chile central, estaria favoreciendo la permanencia de T. monspessulana en areas con alto grado de intervencion antropica.",Positive
El rol de Turdus falcklandii (Aves: Passeriforme) como dispersor de plantas invasoras en el archipielago de Juan Fernandez,Scientific article,Revista Chilena de Historia Natural,"La Reserva Mundial de la Biosfera, Archipielago de Juan Fernandez (33º S) presenta la fl ora insular con mayor endemismo m-2 en el mundo. Tres especies de arbustos introducidos invaden y desplazan la vegetacion nativa de Juan Fernandez, especialmente en la isla Robinson Crusoe. Estas especies, Aristotelia chilensis (maqui, introducido en 1894), Rubus ulmifolius (mora, introducido en 1927) y Ugni molinae (murta, introducido a principios del siglo XX), presentan frutos carnosos que son dispersados principalmente por Turdus falcklandii (zorzal). En este trabajo se plantean y responden cinco preguntas clave, sobre: la capacidad actual de expansion de las plantas invasoras; el efecto del zorzal sobre la dispersion y germinacion de estas plantas; y el posible efecto de controlar zorzal tanto sobre la expansion de las plantas invasoras como las nativas. Se concluye que la interaccion entre el zorzal y los arbustos invasores ha sido clave para explicar su progresiva expansion, ademas de los rasgos de historia de vida de las plantas invasoras. Se plantea que el control o erradicacion de esta ave podria ser una herramienta adecuada para desacelerar el avance de las plantas invasoras. Se recomienda hacer estudios detallados que permitan tomar decisiones sobre la efectividad de controlar en determinada cantidad y tiempo, o erradicar la poblacion de zorzal de la isla Robinson Crusoe como medida de manejo. Ademas, se recomienda realizar estudios que permitan planifi car el control de las fitoplagas en diferentes etapas del ciclo de vida de estas. De no tomarse prontas y efectivas medidas de control de la expansion de maqui, mora y murta se preve una perdida considerable de la biodiversidad terrestre de Robinson Crusoe en un mediano plazo.",Positive
"Efectos Del Fuego Sobre La Avifauna Del Cerro Cayumanque, Region Del Bio-Bio, Chile",Scientific article,Boletin Chileno de Ornitologia,"Los incendios forestales afectan generalmente de forma indirecta a las comunidades de aves, principalmente por las modificaciones en el habitat que se producen. En enero del 2012 un gran incendio afecto parte del Cerro Cayumanque, considerado un sitio prioritario para la conservacion de la biodiversidad en Chile. Con el objetivo de evaluar si el incendio produjo cambios en los ensambles de aves presentes en este, se comparo la avifauna pre (7 años antes) y post-incendio, nueve meses despues de ocurrido el incendio Pichiqueime. Se realizo un muestreo mediante el metodo de conteo por puntos fijos en un gradiente altitudinal en zonas alteradas, medianamente alteradas y no alteradas por el incendio, comparando la avifauna presente en los mismos puntos pre y post-incendio. La riqueza especifica aumento posterior al incendio, para las tres zonas evaluadas, no obstante, esta diferencia no fue significativa (p>0,05). Las abundancias medias de aves en la zona alterada, pre y post incendio, aumentaron significativamente post-incendio (p=0,003), sin embargo, en las zonas sin alteracion y medianamente alterada, la abundancia fue similar a la observada en las mismas zonas previo al incendio (p>0,05). La diversidad de especies fue menor previo al incendio para las tres zonas analizadas (Alterada H’=0,91; Medianamente alterada H’=0,75; Sin alteracion H’=0,73) que post-incendio (Alterada H’=1,12; Medianamente alterada H’= 1,05; Sin alteracion H’=0,84), pero esta diferencia no fue significativa (p>0,05). El incendio que afecto al Cerro Cayumanque solo produjo un aumento significativo en la abundancia de aves en el area que presento mayor daño post-incendio, esto debido a que el area afectada fue principalmente sectores de cultivo y plantaciones agricolas, donde las aves granivoras y generalistas colonizaron rapidamente.",Positive
"Effects of cattle exclusion on the vegetation at a Pink-footed Shearwater (Ardenna creatopus) colony on Robinson Crusoe Island, Chile",Scientific article,Boletin Chileno de Ornitologia,"Con la meta de contribuir a la conservacion del habitat reproductivo de la fardela blanca (Ardenna creatopus), durante el año 2011 establecimos un cerco de exclusion de ganado vacuno alrededor de una colonia reproductiva en la Isla Robinson Crusoe, Archipielago de Juan Fernandez, Chile. El sistema de exclusion consistio de un cerco metalico de 1,6 m de altura alrededor de un poligono de 21.000 m2. Despues de tres años, evaluamos las caracteristicas de la vegetacion al interior y exterior del area excluida mediante parcelas de 20 x 20 m. Entre 2012-2016 tambien monitoreamos 100 madrigueras al interior del area de exclusion para evaluar su condicion estructural. El area excluida presento mayor cobertura vegetal total y mayor altura de plantas en comparacion con el area no excluida. El area no excluida tuvo una cobertura mucho mayor de suelo desnudo y de la planta invasora Acaena argentea. La frecuencia de ocurrencia de tierra desnuda y trun tambien fue mucho mayor en el area no excluida. En el area excluida hubo un aumento significativo de la cobertura de pastos anuales, plantas herbaceas y restos vegetales, y una frecuencia de ocurrencia significativamente mayor de liquenes en comparacion con el area no excluida. No encontramos evidencia de regeneracion de la flora nativa dentro del area excluida, y la exclusion no tuvo un efecto evidente sobre el helecho nativo Blechnum hastatum. Despues de la exclusion, ninguna de las madrigueras monitoreadas mostro evidencia de mas daño. El uso de cercos de exclusion podria ser una estrategia complementaria para contribuir a la restauracion del habitat reproductivo de aves marinas.",Positive
Evaluación de la efectividad de las áreas protegidas para contener procesos de cambio en el uso del suelo y la vegetación. ¿Un índice es suficiente?,Scientific article,Revista Mexicana de Biodiversidad,"Se examina la efectividad de 44 áreas protegidas federales (AP) en México para evitar procesos de cambio en el uso del suelo y la vegetación (CUSV) y se comparan los métodos y resultados con los de algunos estudios previos. Se cuantificó el porcentaje de superficie transformada (ST) en 2002 y su tasa de cambio entre 1993 y de 2002 y se compararon las tasas de cambio observadas en las AP, en las áreas circundantes de cada AP y en sus respectivas ecorregiones. Se integró un índice de efectividad y se caracterizaron los procesos de CUSV en cada AP. En 2002, el 77% de las AP analizadas tenía menos de 20% de ST; casi 30% mostró una reducción en la ST, en tanto que en otro 30%, el incremento en la ST fue mayor que la tasa promedio de las AP analizadas. Poco más del 70% de las AP mostraron tasas de CUSV menores a las de sus áreas circundantes y en 80% de las AP, las tasas fueron menores que en sus ecorregiones. En general, estos resultados coinciden con estudios previos, pero existen variaciones según el enfoque metodológico utilizado. Consecuentemente, los índices de efectividad deben complementarse con una caracterización detallada de los procesos de CUSV y la interpretación de los resultados debe matizarse en función de los métodos.",Positive
Almacenamiento en frío del esperma de la trucha endémica Oncorhynchus mykiss nelsoni: una estrategia para la conservación a corto plazo del germoplasma de especies endémicas,Scientific article,Revista Mexicana de Biodiversidad,"Con el objetivo de determinar un protocolo apropiado para el almacenamiento a corto plazo de los espermatozoides de trucha de San Pedro Mártir, Oncorhynchus mykiss nelsoni, se anestesiaron peces silvestres previamente madurados en cautiverio y el esperma, obtenido por presión abdominal, fue suspendido en una solución extender de Erdhal y Graham a tasas de dilución de 1:3, 1:6 y 1:9 y mantenido a 4° C durante 9 días con una muestra control sin diluir. Los porcentajes de movilidad e integridad de membrana fueron evaluados diariamente. Los resultados indicaron que los espermatozoides suspendidos en una dilución de 1:9 se pueden almacenar a 4° C con movilidad ≥ 80% e integridad de membrana ≥ 65% por 7 y 6 días respectivamente. Además, los resultados muestran que la movilidad disminuye más lentamente que la integridad de la membrana, lo que sugiere que ésta puede utilizarse como un indicador temprano del daño al esperma durante el almacenamiento a corto plazo en bajas temperaturas. Los resultados obtenidos son importantes para apoyar los programas de conservación de esta trucha.",Positive
