Title,Publication_type,Journal,Abstract,PMID
EFECTO DE DIFERENTES DIETAS SOBRE LA GANANCIA DE PESO DE INDIVIDUOS EN CAUTIVERIO DE AGOUTI PACA (RODENTIA: AGOUTIDAE),Scientific article,Revista Mexicana de Mastozoologia,"El tepezcuintle o paca (Agouti paca) es una especie que ha sufrido una intensa cacería en todo su ámbito de distribución, por lo que han surgido esfuerzos para la producción de animales en cautiverio como medio para reducir esta presión. Sin embargo, aún se desconocen aspectos básicos sobre la cría en cautiverio de esta especie y otros son contradictorios, como por ejemplo el tipo de dieta más apropiada. Por lo que el objetivo del trabajo es determinar el efecto de cinco tipos de dieta con diferentes proporciones de proteína sobre el crecimiento de tepezcuintles criados en cautiverio. Se escogieron cinco criaderos de fauna silvestre en la Región Atlántica de Costa Rica, asignando en cada uno una dieta distinta y seleccionando cuatro machos de tres meses de edad. Los pesos de los 20 animales val inicio del estudio fluctuaron entre 3.1 y 4.2 kg y al final entre 6.0 y 8.1 kg. El peso de los tepezcuintles aumentó rápidamente hasta los 210 días. No se encontraron diferencias entre pesos promedio de individuos expuestos a cada dieta, aunque una dieta con una concentración balanceada de proteína pareció brindar mejores resultados. Al comparar los pesos promedios con los de otros estudios, los obtenidos en este trabajo fueron los más altos. Este estudio generó conocimiento sobre los requerimientos proteínicos de tepezcuintles en cautiverio.",Positive
"DISPERSIÓN, SUPERVIVENCIA Y REPRODUCCIÓN DE LA PAVA ALIBLANCA Penelope albipennis
TACZANOWSKI, 1877 (CRACIDAE) REINTRODUCIDA A SU HÁBITAT NATURAL EN PERÚ",Scientific article,Ecología Aplicada,"La pava aliblanca (Penelope albipennis) es un crácido endémico de los bosques secos del
noroeste del Perú y se encuentra críticamente amenazado de extinción debido a la cacería y
destrucción del hábitat. En el año 2000 se estableció el programa de reintroducción de esta especie.
Este consistió en la liberación de individuos nacidos en cautiverio en el zoocriadero Barbara
D’Achille en áreas donde la especie hubiera desaparecido con anterioridad y que en el presente
aseguraran su conservación.
Entre Septiembre de 2001 y Julio de 2003 fueron liberados un total de 20 pavas aliblancas en el
Área de Conservación Privada Chaparrí, Lambayeque, Perú. La adaptación de las aves al lugar fue
medida mediante su dispersión, supervivencia y reproducción.
Se ha determinado en base a la distancia de dispersión, que es factible conectar la población
reintroducida con las poblaciones silvestres aledañas. Con respecto a la supervivencia, evaluada a
los dos años después de la liberación ha sido del 55%. En cuanto a la reproducción, se ha obtenido
tres polluelos nacidos en libertad de padres reintroducidos.",Positive
"Murciélagos (Mammalia: Chiroptera)  en áreas naturales y reforestadas en Rancho Alegre, Paraná, Brasil",Scientific article,Revista de Biología Tropical,"En general, los ambientes naturales se han transformado en pequeños remanentes de bosques, con la consiguiente pérdida de hábitat y la extinción de especies. El estado de Paraná Norte no es una excepción, ya que solo 2 a 4% del ecosistema original se encuentra en pequeños fragmentos de Bosque Semidecidual Estacional. Estudiamos la riqueza de especies y la abundancia de murciélagos en dos fragmentos de bosque de Fazenda Congonhas, en la ciudad de Rancho Alegre, estado de Paraná, Brasil. Se realizaron cuatro muestreos en un área nativa legalmente protegida (107.8ha) y en un área reforestada (11.8ha) entre abril de 2007 y marzo de 2008. Los muestreos comenzaron al anochecer y duraron seis horas, durante dos noches consecutivas en cada ubicación. Los individuos fueron capturados usando ocho redes de niebla, con el mismo esfuerzo de captura en ambos entornos. Un total de 397 individuos, 14 especies y 10 géneros fueron capturados en el área nativa; mientras que en el área reforestada, 105 individuos, seis especies y cuatro géneros. Artibeus lituratus fue la especie más común en ambos fragmentos (n = 328, 65.3%), seguida de Artibeus fimbriatus (n = 44, 8.8%) y Artibeus jamaicensis (n = 30, 6.0%). Otras especies, entre ellas Platyrrhinus lineatus, Carollia perspicillata, Sturnira, lilium, Chrotopterus auritus, Desmodus rotundus, Michronycteris megalotis, Phyllostomus, oceos, gimniosis, gimniosis, mallas, y otras partes de la propiedad, Phyllostomus dis-colour, Myoti levis, Myotiis y otras partes de la casa de campo. El área nativa presentó valores más altos de riqueza de especies (S = 14) y diversidad (H '= 1.4802) en comparación con el área reforestada (S = 6, H' = 0.57015). La prueba t demostró una diferencia significativa entre la diversidad entre los sitios (t = 7.1075). El índice Chao 1 indicó que el esfuerzo de muestreo registró aproximadamente el 78% de la riqueza total de especies para el área nativa y el 75% para el área reforestada. Por lo tanto, la preservación del fragmento de bosque es esencial ya que proporciona hábitat para una comunidad diversa de murciélagos. El manejo forestal y las acciones de reforestación pueden prevenir cambios drásticos en el microclima de las áreas vecinas dentro del fragmento de bosque, y podrían permitir la ocupación de nichos disponibles en el área, por especies oportunistas y generalistas.",Positive
Mortalidad embrionaria y éxito de eclosión en huevos de Trachemys scripta (Testudines: Emydidae) incubados en un área natural protegida,Scientific article,Revista de Biología Tropical,"En el noreste de Costa Rica, la recolección ilegal, la destrucción del hábitat y la gran depredación 011 hembras adultas, jóvenes y huevos de Trachemys scripta produjeron una disminución de la población en los últimos años. El deslizador pequeño tiene un alto potencial de reproducción y los nidos se reubicaron. Entre enero y marzo de 1991, se recolectaron 179 nidos (3220 huevos) del área natural del Refugio Nacional de Vida Silvestre Caño Negro, Costa Rica, y se reubicaron para su incubación en condiciones naturales en un sitio protegido. La media del número de huevos por embrague fue de 19.5 ± 4.5 (rango de 8 a 31) y la media de incubación perlod fue de 77.4 ± 11.4 días (rango de 50 a 110 días). El éxito medio de eclosión fue de 89.6 ± 3.4% (rango 60.0 a 100%). La mortalidad embrionaria media temprana y media fue de 5,5 ± 4,3%, la mortalidad embrionaria tardía promedio fue de 8,5 ± 3,5% y la infertilidad 1,8 ± 1,0%.",Positive
"PROGRAMA EDUCATIVO CON ÉNFASIS EN EL NO USO DE
AGROQUÍMICOS EN LA COMUNIDAD DE MOHENA
CAÑO, BELÉN, MAYNAS, PERÚ",Scientific article,Gestión Ambiental,"Este trabajo se ha realizado en la Comunidad de Mohena Caño durante el período 2004 y 2005 con el fin
de continuar con la aplicación del Programa Educativo con énfasis en el no uso de Agroquímicos
iniciado el año 2003. La metodología utilizada para este proceso estuvo basada en la experimentación,
la cual ha permitido diseñar y aplicar el programa educativo y obtener resultados sobre el impacto
producido, logrando cumplir en su totalidad con la aplicación del programa. Al finalizar el presente
proyecto y con la participación constante de los agricultores se logró que el 100% manifestara haber
ganado experiencia en la aplicación de estas nuevas tecnologías ecológicas para el control de plagas
(uso de trampas de color y de luz) y enfermedades (empleo de extractos de plantas biocida); y el 30%
indica haber experimentado por primera vez in situ el beneficio de estas tecnologías; notándose que el
cambio de actitud de los participantes fluctuó del 67 al 100% hacia el uso de las nuevas alternativas
ecológicas (uso de trampas y de extractos de plantas biocidas).",Positive
"REINTRODUCCION DE ESPECIES
Y REFORZAMIENTO DE POBLACIONES
EN LA CONSERVACION DE AVES EN ESPARA",Scientific article,Ardeola,"En este trabajo se presentan los criterios que normalmente se utilizan para evaluar iniciativas de reintroducción o reforzamiento de poblacion, así como las fases de las que constan estos proyectos y los métodos que se aplican para liberar los ejemplares. Se comenta como ejemplo de un caso concreto el del quebrantahuesos en los Alpes y se expresan algunas evaluaciones del éxito/fracaso de un elevado número de reintroducciones en todo el mundo. Finalmente, se pasa revista a los proyectos que
se llevan a cabo actualmente en España. ",Positive
Comprobación de un nuevo método para reducir la infección por ectoparásitos en cajas nido,Scientific article,Ardeola,"En las poblaciones naturales de aves los polluelos son comúnmente infectados por ectoparásitos. Los efectos que estos ectoparásitos tienen en la eficacia biológica del hospedador se hacen evidentes después de la eliminación completa o de la reducción substancial de su abundancia. Entre los métodos más utilizados, la aplicación de insecticidas es el preferido tradicionalmente. Sin embargo, debido a que la eficacia del insecticida disminuye a lo largo del tiempo, generalmente se necesita la aplicación de varias dosis. Esto resulta en un aumento de la toxicidad y molestias en la reproducción tanto para los padres como para los polluelos. En este estudio, hemos probado la eficacia de un nuevo insecticida (Inesfly). Inesfly actúa mediante la liberación progresiva de compuestos activos solubles en agua, por lo tanto teniendo un efecto a largo plazo comparado con insecticidas anteriores. Mediante la aplicación experimental de este insecticida en forma de pintura dentro de las cajas nido de una población de herrerillo común Cyanistes caeruleus durante la época reproductora, investigamos su efecto en la abundancia de mosca negra (Simuliidae), jején (Culicidae), pulga (Ceratophyllidae), ácaro (Dermanyssidae) y larva de mosca azul (Calliphoridae). El insecticida redujo significativamente la abundancia de la mosca azul Protocalliphora azurea, mientras que la de otros parásitos no se vio afectada. Nuestros resultados muestran que Inesfly no fue efectivo con respecto a los ectoparásitos que infectan las cajas nido de herrerillos excepto para la mosca azul, al menos en la dosis aplicada. Finalmente, no se observaron efectos negativos en los polluelos después de la aplicación de este insecticida.",Positive
"Biología de la conservación del cisne coscoroba Coscoroba coscoroba, su impacto en líneas eléctricas y soluciones.",Scientific article,Ardeola,"Al final del resumen se explica la implementación de dos tipos de ""ahorradores de aves"": espirales de PVC de tres colores (amarillo, blanco y naranja) instalados alrededor de los cables de tierra con una distancia de 10 m. y un ""Aspa"" giratorio que consiste en tres lados de PVC con adhesivos reflectantes instalados en los cables de tierra a través de una percha con una distancia de 12 m entre sí. Se marcaron cinco intervalos con cada color en espiral, cinco con la cuchilla y cinco intervalos se dejaron sin señalización (control). En las paletas marcadas con cuchillas hubo un 86% menos de mortalidad que en el control vano. En comparación con las espirales, la cuchilla fue 76.2% más efectiva que las espirales amarillas y 73.7% más efectiva que las naranjas y las blancas. El tipo ""cazador de aves"" de tipo cruzado no afectó el comportamiento de las aves y la densidad de las aves que cruzaron el vano no fue diferente de las otras.",Positive
"RESCATE Y RETORNO A ESTADO SALVAJE DE UN
OSO PARDO EN ASTURIAS (ESPAÑA)",Scientific article,Galemys,"Una hembra de oso pardo (Ursus arctos, L.), localizada junto a una carretera el 28 de marzo de 1999
con dificultades motrices y que no mostraba el comportamiento habitual de huida, fue capturada y
dotada de un transmisor. Tras una inspección sobre el terreno, en la que sus ritmos respiratorios y
cardiacos y su temperatura corporal resultaron normales, se le detectaron algunas heridas en boca y
hocico. Trasladada a la Facultad de Veterinaria de León en una caja Culvert, fue anestesiada para la realización de radiografías, de ecografía abdominal, y toma de muestras para diversos análisis
(hematológicos, parasitológicos, toxicológicos e infecciosos), todos con resultados normales o negativos, sin que pudiera realizarse un diagnóstico preciso. Se le mantuvo en un recinto aislado, evitando el
contacto humano, aplicándole un tratamiento inespecífico (descanso, abundante alimentación y suministro de un antibiótico de amplio espectro). Tras la positiva recuperación y con una aparente buena
motricidad se le liberó el 7 de abril de 1999 a 2,5 Km del sitio de captura. Desde entonces se le radiolocalizó
continuamente pero el transmisor empezó a fallar y se perdió la señal el 11 de abril. Se identificó
visualmente el ejemplar el 25 de mayo, por portar aún el transmisor, alimentándose en una ladera solana a 2 Km del punto de suelta, aparentemente en buenas condiciones. Los resultados de los análisis
toxicológicos sobre muestra de sangre, disponibles algunos meses más tarde, detectaron la presencia de
carbofurano y metomilo en dosis que indicaban su posible ingesta como cebo.",Positive
Resultados de una traslocación de osos pardos de Eslovenia a los Pirineos Centrales,Scientific article,Galemys,"En el marco de un proyecto Life-Naturaleza de la Unión Europea, en 1996 y 1997 se liberaron en los Pirineos Centrales tres osos pardos (2 hembras-Ziva y Mellba- y 1 macho -Pyros-) procedentes de Eslovenia. El tamaño de las áreas de campeo y los desplazamientos de los osos difirieron según los individuos y los años, siendo el primer año muy grandes y recorriendo largas distancias. Los desplazamientos más cortos y las áreas más pequeñas se presentaron cuando las hembras tuvieron crías del año. Pyros realizó mayores desplazamientos diarios (-
x = 3,01 km, SD = 2,89 km) que Ziva (- x = 2,07 km, SD =
2,09 km), siendo muy habitual el movimiento transfronterizo entre Francia, Cataluña y Aragón. Una de las crías se halla en estos momentos en contacto con la población pirenáica autóctona de osos. Seleccionaron las orientaciones norte, con pendientes de entre 30 y 60 grados, las altitudes comprendidas entre
1.301 y 1.800 m y, los bosques de roble, haya y abeto. En 1997, Mellba parió tres crías y fue muerta en
Francia por un cazador en 1997 y, Ziva dos crías. Dos de los huérfanos de Mellba han sobrevivido hasta
este momento. Los análisis genéticos de los osos traslocados y de sus crías han permitido comprobar
casos de multiparentalidad, sólo descritos en el oso grizzly de Norteamérica. En Cataluña (1996-2000),
se atribuyeron 118 daños a los osos, aunque se indemnizaron 178 cabezas de ganado muertas y 397
desaparecidas. La población en el año 2001 es de seis ejemplares (1 macho adulto de 13 años, 1 hembra
adulta de 12 años y, 3 machos y 1 hembra de 4 años). En junio de 2001 fue encontrada muerta en Francia
una cría macho nacida ese mismo año. El alto número de crías en las camadas, la supervivencia de dos
crías huérfanas con 8 meses, los pesos de los ejemplares nacidos en los Pirineos y capturados (una cría
de segundo y un subadulto de tercer año), los excelentes datos de las analíticas de sangre realizadas y la
gran variedad de la dieta encontrada en los análisis preliminares de las muestras, indican una buena
adaptación de los osos a las condiciones tróficas y de hábitat del Pirineo. Por el contrario, la muerte de
una osa en una cacería demuestra la existencia de ciertos riesgos para estos ejemplares.",Positive
"PRIMEROS RESULTADOS SOBRE LA ALIMENTACIÓN
SUPLEMENTARIA DE LINCES IBÉRICOS EN LIBERTAD
MEDIANTE EL USO DE CORRALES",Scientific article,Galemys,"El lince ibérico sigue desapareciendo, entre otras razones, por la escasez del conejo. Se ha propuesto que la alimentación suplementaria podría temporalmente contrarrestar la escasez de conejos. Sin embargo, se desconoce si tal actuación sería o no efectiva. Aquí experimentamos tres diseños de
corrales para la alimentación suplementaria del lince ibérico en la Reserva Biológica de Doñana. Dos de los corrales eran de 4 x 4 x 1,3 m donde los linces podían entrar saltando. Un tipo de estos corrales estaba rodeado por rampas de arena. El otro tipo era un corral de 4 x 4 m situado en la esquina de un cercado de 1 ha y 2 m de alto, adonde se accedía trepando por troncos o saltando por unos escalones. Los corrales fueron cebados con pollos entre agosto de 2002 y febrero de 2003. El lince fue la única
especie que entró en los corrales usando dos de ellos, uno pequeño rodeado de las rampas (cuatro
linces) y el grande de 1 ha (dos de los cuatro anteriores). Después de que los usaran la primera vez,
entraron casi diariamente. Accedieron al interior por los escalones y desde la rampa. Zorros,
meloncillos, y tejones, por este orden de frecuencia, también se acercaron a los corrales, pero ninguno entró. Este estudio indica que los linces pueden hacer uso de presas artificiales y que los corrales
experimentados son eficaces excluyendo a otros depredadores terrestres. Más estudios y experimentos son necesarios antes de poder concluir que la alimentación suplementaria puede ser útil para la
conservación del lince ibérico en el campo.",Positive
"TASA DE SUPERVIVENCIA DEL GATO MONTÉS
Felis silvestris (SCHREBER, 1777), CRIADO EN
CAUTIVIDAD Y REINTRODUCIDO EN LA NATURALEZA.
RESULTADOS PRELIMINARES",Scientific article,Galemys,"Se analizó la supervivencia y las causas de mortalidad de 37 gatos monteses reintroducidos y radioseguidos en el macizo del Ports de Tortosa i Beseit en Tarragona, entre los años 2001 y
2005. Los ejemplares se agruparon según los siguientes factores experimentales: condiciones de cautividad (suaves vs. duras), condiciones de liberación (suaves vs. duras), liberación de hembras
con o sin cachorros (sólo las hembras) y sexo (machos vs. hembras sin cachorros). Mediante el método Kaplan-Meier se estudió el efecto que las condiciones de cautividad, las técnicas de liberación, la presencia de cachorros en la liberación o el sexo tienen sobre la supervivencia de los
ejemplares reintroducidos. La supervivencia se comparó entre los diferentes grupos mediante el
Log-rank test. Se describieron las causas de mortalidad y la variación diaria de peso de los ejemplares reintroducidos. No se detectaron diferencias significativas entre la supervivencia de los
diferentes grupos según las condiciones de cautividad, ni de liberación, ni el sexo. En cambio, las hembras liberadas con cachorros mostraron una supervivencia mayor que las hembras liberadas
sin cachorros. Considerando todos los ejemplares conjuntamente, la tasa de supervivencia a 180
días fue del 24,7% y la mediana del tiempo de supervivencia de 47 días. Las causas de mortalidad
más importantes fueron las de origen humano (atropellos y muertos en granjas). Así mismo, la
mayoría de los ejemplares muertos por causas naturales presentaron una pérdida de peso muy
acusada. En general, la supervivencia de los ejemplares liberados es muy baja, que confirma la
dificultad de reintroducir a la naturaleza carnívoros criados en cautividad.",Positive
"OCUPACIÓN Y REPRODUCCIÓN DEL LIRÓN GRIS
(Glis glis LINNAEUS, 1766) EN NIDALES ARTIFICIALES
EN BOSQUES CADUCIFOLIOS CATALANES",Scientific article,Galemys,"Se estudia la tasa de ocupación de nidales artificiales (cajas-nido) por el lirón gris en bosques
caducifolios catalanes. Para ello, durante el período 2004-2005 se revisaron sistemáticamente
más de 400 nidales de cuatro tipos distintos (3 modelos para aves insectívoras, y uno especialmente diseñado para lirones) situados en 6 localidades diferentes. La tasa de ocupación fue muy heterogénea, dependiendo tanto de la localidad como del tipo de nidal. Así pues, la frecuencia
máxima de ocupación de cajas por individuos adultos se situó en el 25% en el Montnegre-Corredor (robledal-castañar), y en el 42% en el hayedo de la Grevolosa, mientras que en otras localidades fue muy baja o inexistente. Los nidales de los modelos “Sitta” y “Parus” rindieron resultados parecidos en las localidades en que se dispusieron conjuntamente. Los nidales empezaron
a ocuparse en julio, incrementándose su ocupación en agosto, época en que las hembras buscan
nidos apropiados para alumbrar. En septiembre se encontraron hembras con crías pequeñas en
el Montnegre-Corredor, la única localidad en que se ha podido comprobar la reproducción. El
número medio de crías por camada fue de 4,75, con una variación entre 4 y 7 crías por nido (n=
4). La fecha de nacimiento de las crías fue estimada en tres nidos el 19, 21 y 22 de septiembre
del 2005, hecho que demuestra una elevada sincronía. En noviembre se observó un incremento
de la presencia de lirones que se puede asociar a la dispersión juvenil. Finalmente, en la revisión
realizada en pleno invierno no se encontró ningún individuo de lirón gris en las cajas.",Positive
"SUPERVIVENCIA, DISPERSIÓN Y SELECCIÓN
DE RECURSOS DE CORZOS Capreolus capreolus
(LINNAEUS, 1758) REINTRODUCIDOS EN UN HÁBITAT
MEDITERRÁNEO",Scientific article,Galemys,"Durante los años 2002, 2003 y 2004 se liberaron un total de 38 ejemplares de corzo (23
hembras y 15 machos) en la Reserva Nacional de Caza de Ports (Taragona, Cataluña) con el
objetivo de analizar su viabilidad como paso previo a un programa de reintroducción en esta
zona. En total 29 corzos fueron capturados en la reserva de Chizé (Landas, Francia) y 9 más en
la RNC de Alt-Pallars (Lleida, Cataluña). El corzo desapareció de este macizo a finales del siglo
XIX, de forma similar a otras zonas del litoral mediterráneo, como consecuencia de la reducción de la superficie forestal y la falta de gestión y conservación de sus poblaciones. En Cataluña, desde principios de la década de 1990, se han iniciado diferentes proyectos de reintroducción de esta especie en las cordilleras litorales con vistas a la restauración de la comunidad de ungulados
salvajes. A partir de 589 localizaciones de 30 de estos ejemplares se estimaron los patrones de
dispersión, la probabilidad de supervivencia y la tasa de mortalidad, y de esta forma se evaluó la
viabilidad de la reintroducción. La selección de recursos se calculó mediante regresión logística y
el resultado predice la presencia de los corzos reintroducidos en el área elegida.",Positive
"PROGRAMA DE CONSERVACIÓN DEL BORREGO
CIMARRÓN (Ovis canadensis weemsi) EN BAJA
CALIFORNIA SUR, MÉXICO",Scientific article,Galemys,"Dada la importancia ecológica, cultural y económica que representa el borrego cimarrón y
considerando su situación poblacional en México, OVIS en 1995 presenta al Gobierno Federal el “Programa de conservación del borrego cimarrón (Ovis canadensis weemsi) en Baja California Sur
(BCS), México”, el cual es avalado y autorizado, contando con el apoyo de los gobiernos tanto
estatal como municipales en cuestión. El programa se desarrolla en 2 etapas: 1) Introducción y reproducción del borrego cimarrón (O. c. weemsi) en isla El Carmen, BCS y 2) Repoblación de tierras continentales con borregos procedentes de dicha isla y posterior aprovechamiento
sustentable. Actualmente se estima una población de 450 borregos en isla El Carmen, por lo
que OVIS tiene como objetivo continuar con las actividades de repoblación a largo plazo para
contribuir a la recuperación de los niveles poblacionales alcanzados históricamente. El mayor
éxito del programa se alcanzará cuando las poblaciones de borrego cimarrón vuelvan a cubrir las
tierras de Baja California Sur en toda su área de distribución original, así como otras áreas de
distribución histórica de la especie.",Positive
Estima de la abundancia de palomas (Columba livia var.) de la ciudad de Barcelona y valoración de la efectividad del control por eliminación de individuos,Scientific article,Arxius de Miscel-lania zoologica,"Uno de los métodos más comúnmente utilizados para el control de las poblaciones de palomas urbanas es la captura y eliminación selectiva de individuos. Con este método, la Agencia de Salud Pública de Barcelona (ASPB) eliminó entre 1991 y 2006, un total de 227.479 palomas. En el presente trabajo se compara la abundancia de palomas de la ciudad de Barcelona estimada en 1991 (183.887 ± 14.914), con los valores obtenidos en una nueva estima realizada en 2006, con un total de 256.66 ± 26.210 (IC 95%) palomas. Mientras que en el centro de la ciudad la densidad de palomas no aumentó entre esos años, la densidad en todo el anillo que rodea el centro aumentó de forma significativa, conduciendo a un aumento global de toda la población urbana. El número de denuncias recibidas por distrito por molestias ocasionadas por las palomas no se correlacionó con su abundancia. El esfuerzo de capturas por distrito realizado por la ASPB se correlacionó con la abundancia de palomas y no con el número de denuncias recibidas, lo que indica que las actuaciones realizadas siguen en general un protocolo técnico. La densidad de palomas por distrito se correlacionó significativamente con la densidad de habitantes de cada distrito, pero no con el número total de habitantes. Los datos presentados demuestran la baja efectividad de las medidas de control de palomas por eliminación de individuos, y abogan por un mayor énfasis en los métodos de control centrados en los factores limitantes de la especie, en concreto la oferta alimentaria y los lugares de nidificación.",Positive
